{
  "$schema": "https://json-schema.org/draft/2020-12/schema",
  "$id": "https://rideidle.local/schema/pack.schema.json",
  "title": "Content pack manifest (pack.json)",
  "type": "object",
  "properties": {
    "schema": {
      "description": "Version of the content schema this pack follows.",
      "const": 0
    },
    "name": { "$ref": "common.schema.json#/$defs/slug" },
    "version": {
      "description": "Pack version, year.month.patch.",
      "type": "string",
      "pattern": "^[0-9]{4}\\.[0-9]{1,2}\\.[0-9]+$"
    },
    "description": { "$ref": "common.schema.json#/$defs/i18n" },
    "withdrawn": {
      "description": "The cars and parts of the pack that are no longer on offer: a withdrawn part leaves the shop and the crates, a withdrawn car has no source (no wreck to start with, nothing on the exchange or at the dealer). They stay in the pack, so that what players own works. Written by the publication of a pack, from the definitions that were withdrawn.",
      "type": "array",
      "items": { "$ref": "common.schema.json#/$defs/slug" },
      "uniqueItems": true
    },
    "checksum": {
      "description": "Written by content:export: the checksum of the content of the pack (the manifest without its version and this field, and every document). When it is there, content:import checks it, so a pack that was changed after it was exported is not taken for the one that was.",
      "type": "string",
      "pattern": "^[0-9a-f]{64}$"
    }
  },
  "required": ["schema", "name", "version"],
  "additionalProperties": false
}
